{
  "$schema": "risk-heatmap-v1",
  "session_id": "eureka-risk-quick-233519",
  "generated_at": "2026-05-16T17:01:00Z",
  "scope": "all",
  "scope_name": null,
  "analysis_window_days": 30,
  "files": [
    {
      "path": ".claude/skills/workflow/_shared/playwright-session.js",
      "risk_score": 75,
      "risk_tier": "HIGH",
      "signals": {
        "git_churn_30d": 0,
        "loc": 1104,
        "missing_req_id": true,
        "has_paired_test": false,
        "complexity_hint": "high",
        "domain": "auth"
      }
    },
    {
      "path": "tools/validators/session_validator.py",
      "risk_score": 70,
      "risk_tier": "HIGH",
      "signals": {
        "git_churn_30d": 0,
        "loc": 313,
        "missing_req_id": true,
        "has_paired_test": false,
        "complexity_hint": "medium",
        "domain": "auth"
      }
    },
    {
      "path": ".claude/skills/workflow/_shared/ips/tests/test_concurrency_controller.py",
      "risk_score": 70,
      "risk_tier": "HIGH",
      "signals": {
        "git_churn_30d": 0,
        "loc": 294,
        "missing_req_id": true,
        "has_paired_test": false,
        "complexity_hint": "medium",
        "domain": "financial"
      }
    },
    {
      "path": ".claude/skills/workflow/_shared/ips/concurrency_controller.py",
      "risk_score": 70,
      "risk_tier": "HIGH",
      "signals": {
        "git_churn_30d": 0,
        "loc": 259,
        "missing_req_id": true,
        "has_paired_test": false,
        "complexity_hint": "medium",
        "domain": "financial"
      }
    },
    {
      "path": ".claude/skills/workflow/_shared/concurrency/token_bucket.py",
      "risk_score": 70,
      "risk_tier": "HIGH",
      "signals": {
        "git_churn_30d": 0,
        "loc": 324,
        "missing_req_id": true,
        "has_paired_test": false,
        "complexity_hint": "medium",
        "domain": "financial"
      }
    },
    {
      "path": ".claude/scripts/wf-verify-sync/vs-finalize-session.sh",
      "risk_score": 70,
      "risk_tier": "HIGH",
      "signals": {
        "git_churn_30d": 0,
        "loc": 231,
        "missing_req_id": true,
        "has_paired_test": false,
        "complexity_hint": "medium",
        "domain": "auth"
      }
    },
    {
      "path": ".claude/scripts/wf-fix-session.sh",
      "risk_score": 70,
      "risk_tier": "HIGH",
      "signals": {
        "git_churn_30d": 0,
        "loc": 240,
        "missing_req_id": true,
        "has_paired_test": false,
        "complexity_hint": "medium",
        "domain": "auth"
      }
    },
    {
      "path": ".claude/scripts/wf-fix-migrate-sessions.sh",
      "risk_score": 70,
      "risk_tier": "HIGH",
      "signals": {
        "git_churn_30d": 0,
        "loc": 401,
        "missing_req_id": true,
        "has_paired_test": false,
        "complexity_hint": "medium",
        "domain": "auth"
      }
    },
    {
      "path": ".claude/scripts/wf-fix-bugs/init-session-state.sh",
      "risk_score": 70,
      "risk_tier": "HIGH",
      "signals": {
        "git_churn_30d": 0,
        "loc": 233,
        "missing_req_id": true,
        "has_paired_test": false,
        "complexity_hint": "medium",
        "domain": "auth"
      }
    },
    {
      "path": ".claude/scripts/wf-cmi/build-fe-permission-graph.sh",
      "risk_score": 70,
      "risk_tier": "HIGH",
      "signals": {
        "git_churn_30d": 0,
        "loc": 367,
        "missing_req_id": true,
        "has_paired_test": false,
        "complexity_hint": "medium",
        "domain": "auth"
      }
    },
    {
      "path": ".claude/scripts/skill-compliance-audit.sh",
      "risk_score": 70,
      "risk_tier": "HIGH",
      "signals": {
        "git_churn_30d": 0,
        "loc": 563,
        "missing_req_id": true,
        "has_paired_test": false,
        "complexity_hint": "high",
        "domain": "regulatory"
      }
    },
    {
      "path": ".claude/skills/workflow/_shared/ips/tests/test_resume_router.py",
      "risk_score": 65,
      "risk_tier": "HIGH",
      "signals": {
        "git_churn_30d": 0,
        "loc": 510,
        "missing_req_id": true,
        "has_paired_test": false,
        "complexity_hint": "high",
        "domain": "api"
      }
    },
    {
      "path": ".claude/skills/workflow/_shared/ips/resume_router.py",
      "risk_score": 65,
      "risk_tier": "HIGH",
      "signals": {
        "git_churn_30d": 0,
        "loc": 647,
        "missing_req_id": true,
        "has_paired_test": false,
        "complexity_hint": "high",
        "domain": "api"
      }
    },
    {
      "path": ".claude/scripts/audit/contract-conformance.sh",
      "risk_score": 65,
      "risk_tier": "HIGH",
      "signals": {
        "git_churn_30d": 0,
        "loc": 328,
        "missing_req_id": true,
        "has_paired_test": false,
        "complexity_hint": "medium",
        "domain": "regulatory"
      }
    },
    {
      "path": "tools/scenarios/test_g_session_cleanup.py",
      "risk_score": 60,
      "risk_tier": "HIGH",
      "signals": {
        "git_churn_30d": 0,
        "loc": 155,
        "missing_req_id": true,
        "has_paired_test": false,
        "complexity_hint": "low",
        "domain": "auth"
      }
    },
    {
      "path": "tests/backend/Eureka.UnitTests/Modules/Tax/Legacy/LegacyPasswordEncryptorTests.cs",
      "risk_score": 60,
      "risk_tier": "HIGH",
      "signals": {
        "git_churn_30d": 0,
        "loc": 122,
        "missing_req_id": true,
        "has_paired_test": false,
        "complexity_hint": "low",
        "domain": "auth"
      }
    },
    {
      "path": "tests/backend/Eureka.UnitTests/Modules/Tax/Legacy/LegacyCodeGeneratorTests.cs",
      "risk_score": 60,
      "risk_tier": "HIGH",
      "signals": {
        "git_churn_30d": 0,
        "loc": 91,
        "missing_req_id": true,
        "has_paired_test": false,
        "complexity_hint": "low",
        "domain": "financial"
      }
    },
    {
      "path": "tests/backend/Eureka.UnitTests/Migration/Rules/PasswordHashRuleTests.cs",
      "risk_score": 60,
      "risk_tier": "HIGH",
      "signals": {
        "git_churn_30d": 0,
        "loc": 62,
        "missing_req_id": true,
        "has_paired_test": false,
        "complexity_hint": "low",
        "domain": "auth"
      }
    },
    {
      "path": "apps/smarttax-web/next-env.d.ts",
      "risk_score": 60,
      "risk_tier": "HIGH",
      "signals": {
        "git_churn_30d": 0,
        "loc": 6,
        "missing_req_id": true,
        "has_paired_test": false,
        "complexity_hint": "low",
        "domain": "financial"
      }
    },
    {
      "path": "apps/mobile-staff/__tests__/__mocks__/auth-store-mock.js",
      "risk_score": 60,
      "risk_tier": "HIGH",
      "signals": {
        "git_churn_30d": 0,
        "loc": 10,
        "missing_req_id": true,
        "has_paired_test": false,
        "complexity_hint": "low",
        "domain": "auth"
      }
    },
    {
      "path": "apps/backend/Eureka.Infrastructure/Persistence/Migrations/20260516155158_SyncPendingModelChanges_20260516.cs",
      "risk_score": 60,
      "risk_tier": "HIGH",
      "signals": {
        "git_churn_30d": 0,
        "loc": 1588,
        "missing_req_id": true,
        "has_paired_test": false,
        "complexity_hint": "high",
        "domain": "infrastructure"
      }
    },
    {
      "path": ".claude/skills/workflow/_shared/tests/test_profile_resolver_xf08.py",
      "risk_score": 60,
      "risk_tier": "HIGH",
      "signals": {
        "git_churn_30d": 0,
        "loc": 302,
        "missing_req_id": true,
        "has_paired_test": false,
        "complexity_hint": "medium",
        "domain": "api"
      }
    },
    {
      "path": ".claude/skills/workflow/_shared/profiles/tests/test_profile_resolver.py",
      "risk_score": 60,
      "risk_tier": "HIGH",
      "signals": {
        "git_churn_30d": 0,
        "loc": 233,
        "missing_req_id": true,
        "has_paired_test": false,
        "complexity_hint": "medium",
        "domain": "api"
      }
    },
    {
      "path": ".claude/skills/workflow/_shared/profiles/profile_resolver.py",
      "risk_score": 60,
      "risk_tier": "HIGH",
      "signals": {
        "git_churn_30d": 0,
        "loc": 369,
        "missing_req_id": true,
        "has_paired_test": false,
        "complexity_hint": "medium",
        "domain": "api"
      }
    },
    {
      "path": ".claude/skills/workflow/_shared/profile_resolver.py",
      "risk_score": 60,
      "risk_tier": "HIGH",
      "signals": {
        "git_churn_30d": 0,
        "loc": 345,
        "missing_req_id": true,
        "has_paired_test": false,
        "complexity_hint": "medium",
        "domain": "api"
      }
    },
    {
      "path": ".claude/skills/workflow/_shared/concurrency/backpressure.py",
      "risk_score": 60,
      "risk_tier": "HIGH",
      "signals": {
        "git_churn_30d": 0,
        "loc": 182,
        "missing_req_id": true,
        "has_paired_test": false,
        "complexity_hint": "low",
        "domain": "financial"
      }
    },
    {
      "path": ".claude/skills/workflow/_shared/concurrency/__init__.py",
      "risk_score": 60,
      "risk_tier": "HIGH",
      "signals": {
        "git_churn_30d": 0,
        "loc": 54,
        "missing_req_id": true,
        "has_paired_test": false,
        "complexity_hint": "low",
        "domain": "financial"
      }
    },
    {
      "path": ".claude/skills/workflow/_shared/cdg/cdg_handler.py",
      "risk_score": 60,
      "risk_tier": "HIGH",
      "signals": {
        "git_churn_30d": 0,
        "loc": 245,
        "missing_req_id": true,
        "has_paired_test": false,
        "complexity_hint": "medium",
        "domain": "api"
      }
    },
    {
      "path": ".claude/scripts/wf-verify-sync/vs-migrate-flat-to-sessions.sh",
      "risk_score": 60,
      "risk_tier": "HIGH",
      "signals": {
        "git_churn_30d": 0,
        "loc": 136,